### ISSUE TITLE
Login problem

### ISSUE THREAD

**Issue by pculka** [fireice-uk/xmr-stak#540]
Hi,

I have a problem with a connection to supportxmr pool behind a firewall. I've installed it and when I'm connected via a mobile hotspot, everything works. Once I get on LAN, I get:
```
[2017-12-14 13:57:43] : Fast-connecting to pool.supportxmr.com:3333 pool ...
[2017-12-14 13:57:43] : Pool pool.supportxmr.com:3333 connected. Logging in...
[2017-12-14 13:57:53] : SOCKET ERROR - [pool.supportxmr.com:3333] CALL error: Timeout while waiting for a reply
```

It's an obious firewall issue, but what should I look for? TCPDump shows following:
```
13:58:38.566897 IP srv.loc.59834 > ip212232025156.rev.nessus.at.dec-notes: Flags [FP.], seq 1:236, ack 1, win 229, options [nop,nop,TS val 61637200 ecr 601209573], length 235
13:58:45.270896 IP srv.loc.59832 > ip212232025156.rev.nessus.at.dec-notes: Flags [FP.], seq 1:236, ack 1, win 229, options [nop,nop,TS val 61643904 ecr 601199570], length 235
13:58:54.166910 IP srv.loc.59834 > ip212232025156.rev.nessus.at.dec-notes: Flags [FP.], seq 1:236, ack 1, win 229, options [nop,nop,TS val 61652800 ecr 601209573], length 235

```

any idea how can I simulate the login process?

**Comment by JerichoJones** [comment]
Sorry, no.
